{
  "domain_id": "a1000000-0001-4000-8000-000000000001",
  "organization_id": "00000000-0000-0000-0000-000000000001",
  "name": "Sales",
  "description": "Sales domain: order ingestion, enrichment, and consumption for e-commerce.",
  "owner_user_id": null,
  "parent_domain_id": null,
  "is_council": false,
  "metadata": {
    "tags": ["sales", "orders", "revenue"],
    "business_unit": "Commerce"
  },
  "created_at": "2026-02-17T00:00:00Z",
  "updated_at": "2026-02-17T00:00:00Z"
}
